{
  "lexspec": "0.1",
  "id": "no-anchor",
  "kind": "clause",
  "jurisdiction": [
    "RU"
  ],
  "corpus": [
    {
      "id": "gk-rf",
      "title": "Гражданский кодекс РФ, извлечение (ст. 506, ст. 309)",
      "revision": "2026-10-01",
      "text": "corpus/gk-rf-2026-10-01.txt",
      "text_sha256": "5fee7dadad023cceb9f94247f76a42931dedf95c3977f04654ab758d47612cb0"
    }
  ],
  "terms": [
    {
      "name": "поставщик",
      "def": "лицо, осуществляющее предпринимательскую деятельность и передающее товары",
      "status": "closed"
    },
    {
      "name": "покупатель",
      "def": "лицо, приобретающее товары для использования в предпринимательской деятельности",
      "status": "closed"
    },
    {
      "name": "убытки",
      "def": "расходы, которые лицо произвело или должно будет произвести для восстановления нарушенного права",
      "status": "closed"
    }
  ],
  "atoms": [
    {
      "id": "a1",
      "relation": "duty",
      "bearer": "поставщик",
      "counterparty": "покупатель",
      "action": {
        "verb": "возместить",
        "object": "убытки",
        "open": false
      },
      "conditions": [],
      "temporal": {
        "from": "2026-01-01",
        "until": null
      },
      "anchor": {
        "corpus": "gk-rf",
        "article": "ст. 506",
        "span": "обязуется возместить убытки покупателя в полном объёме",
        "note": "этой фразы в закреплённом извлечении нет: пересказ вместо цитаты"
      }
    }
  ],
  "conflicts_policy": {
    "default": "report",
    "lex_specialis": []
  },
  "escapes": [
    {
      "atom": "a1",
      "reason": "S2_SPAN_NOT_FOUND",
      "detail": "цитата не найдена в закреплённой редакции, поэтому атом считается открытым, а не проверенным"
    }
  ]
}
