{
  "lexspec": "0.1",
  "id": "gk-rf-395-quantified",
  "kind": "clause",
  "jurisdiction": [
    "RU"
  ],
  "corpus": [
    {
      "id": "gk-rf-395",
      "title": "ГК РФ часть первая, ст. 395, извлечение",
      "revision": "2026-10-28",
      "text": "corpus/gk-rf-395-2026-10-28.txt",
      "text_sha256": "6522e8ef1eef604cc2f65d95d8c15fc833338996679b0b56b198a02e3a355a08"
    }
  ],
  "terms": [
    {
      "name": "должник",
      "def": "лицо, обязанное уплатить денежную сумму кредитору",
      "status": "closed"
    },
    {
      "name": "кредитор",
      "def": "лицо, которому причитается денежная сумма",
      "status": "closed"
    },
    {
      "name": "сумма долга",
      "def": "неуплаченная денежная сумма, на которую начисляются проценты",
      "status": "closed"
    },
    {
      "name": "проценты",
      "def": "денежная сумма, начисляемая на сумму долга за период просрочки",
      "status": "closed"
    },
    {
      "name": "неустойка",
      "def": "денежная сумма, согласованная сторонами за неисполнение обязательства",
      "status": "closed"
    },
    {
      "name": "сложные проценты",
      "def": "начисление процентов на ранее начисленные проценты",
      "status": "closed"
    },
    {
      "name": "суд",
      "def": "орган, рассматривающий спор по заявлению должника",
      "status": "closed"
    },
    {
      "name": "ключевая ставка",
      "def": "ставка Банка России, действовавшая в соответствующие периоды; ряд публикуется официально и датирован, но в корпусе его нет",
      "status": "open"
    }
  ],
  "atoms": [
    {
      "id": "a1",
      "relation": "duty",
      "bearer": "должник",
      "counterparty": "кредитор",
      "action": {
        "verb": "уплатить",
        "object": "проценты",
        "open": false
      },
      "conditions": [
        "неправомерное удержание, уклонение от возврата или иная просрочка"
      ],
      "temporal": {
        "from": "2016-08-01",
        "until": null
      },
      "anchor": {
        "corpus": "gk-rf-395",
        "article": "ст. 395 п. 1",
        "span": "подлежат уплате проценты на сумму долга",
        "note": "ядро обязанности; размер не в этой норме"
      }
    },
    {
      "id": "a2",
      "relation": "duty",
      "bearer": "должник",
      "counterparty": "кредитор",
      "action": {
        "verb": "уплатить по ключевой ставке",
        "object": "проценты",
        "open": false
      },
      "conditions": [
        "ставка Банка России, действовавшая в соответствующие периоды",
        "иной размер не установлен законом или договором"
      ],
      "temporal": {
        "from": "2016-08-01",
        "until": null
      },
      "anchor": {
        "corpus": "gk-rf-395",
        "article": "ст. 395 п. 1",
        "span": "Размер процентов определяется ключевой ставкой",
        "note": "величина приходит по ссылке на внешний датированный ряд; в v0.1 нет слоя количеств"
      },
      "quantity": "q1"
    },
    {
      "id": "a3",
      "relation": "power",
      "bearer": "кредитор",
      "counterparty": "должник",
      "action": {
        "verb": "требовать возмещения убытков сверх процентов",
        "object": "сумма долга",
        "open": false
      },
      "conditions": [
        "убытки превышают сумму процентов"
      ],
      "temporal": {
        "from": "2016-08-01",
        "until": null
      },
      "anchor": {
        "corpus": "gk-rf-395",
        "article": "ст. 395 п. 2",
        "span": "он вправе требовать от должника",
        "note": "власть требовать превышения — second-order position, не право на проценты"
      }
    },
    {
      "id": "a4",
      "relation": "privilege",
      "bearer": "должник",
      "counterparty": "кредитор",
      "action": {
        "verb": "не уплачивать проценты при согласованной неустойке",
        "object": "проценты",
        "open": true
      },
      "conditions": [
        "стороны согласовали неустойку за неисполнение денежного обязательства",
        "иное не предусмотрено законом или договором"
      ],
      "temporal": {
        "from": "2015-06-01",
        "until": null
      },
      "anchor": {
        "corpus": "gk-rf-395",
        "article": "ст. 395 п. 4",
        "span": "проценты не подлежат взысканию, если иное не",
        "note": "это не позиция, а поражение (defeat) требования п. 1; v0.1 не умеет выражать поражение"
      }
    },
    {
      "id": "a5",
      "relation": "duty",
      "bearer": "кредитор",
      "counterparty": "должник",
      "action": {
        "verb": "не начислять",
        "object": "сложные проценты",
        "open": false
      },
      "conditions": [
        "если иное не установлено законом; для предпринимательских обязательств — если иное не предусмотрено законом или договором"
      ],
      "temporal": {
        "from": "2015-06-01",
        "until": null
      },
      "anchor": {
        "corpus": "gk-rf-395",
        "article": "ст. 395 п. 5",
        "span": "Начисление процентов на проценты (сложные проценты) не допускается",
        "note": "запрет как обязанность коррелята: у кредитора нет права начислять сложные проценты"
      }
    },
    {
      "id": "a6",
      "relation": "power",
      "bearer": "суд",
      "counterparty": "должник",
      "action": {
        "verb": "уменьшить проценты с нижней границей",
        "object": "проценты",
        "open": true
      },
      "conditions": [
        "сумма явно несоразмерна последствиям нарушения",
        "по заявлению должника",
        "не ниже суммы по ставке п. 1"
      ],
      "temporal": {
        "from": "2015-06-01",
        "until": null
      },
      "anchor": {
        "corpus": "gk-rf-395",
        "article": "ст. 395 п. 6",
        "span": "заявлению должника вправе уменьшить предусмотренные договором проценты",
        "note": "власть с количественной нижней границей — требует и power, и количество"
      }
    }
  ],
  "conflicts_policy": {
    "default": "report",
    "lex_specialis": []
  },
  "escapes": [
    {
      "atom": "a4",
      "reason": "OPEN_TERM",
      "detail": "п. 4 не является позицией: он снимает требование п. 1 при согласованной неустойке. Это поражение (defeat), конструкта для которого в v0.1 нет — см. docs/13"
    },
    {
      "atom": "a6",
      "reason": "OPEN_TERM",
      "detail": "власть суда ограничена снизу количеством (ставка п. 1); без слоя количеств граница невыразима, а власть без границы — не та власть"
    }
  ],
  "series": [
    {
      "id": "key-rate-a09-14",
      "publisher": "Банк России",
      "basis": {
        "corpus": "gk-rf-395",
        "article": "Пленум ВС РФ № 7 п. 39",
        "span": "размер процентов за пользование чужими денежными средствами"
      },
      "format": "json points (date, value_bp)",
      "path": "lab/series/key-rate-a09-14.json",
      "digest": "edb0f82b026d2561ec63d45710408366716e66f20c0241395760bbf1d7885f69",
      "retrieved_at": "2026-10-29",
      "covers": {
        "from": "2017-01-09",
        "to": "2020-07-27"
      }
    }
  ],
  "quantities": [
    {
      "id": "q1",
      "kind": "rate_of",
      "base": "сумма долга",
      "series": "key-rate-a09-14",
      "period": {
        "from": "2017-01-09",
        "to": "2020-07-27",
        "segments": "rate_change",
        "day_count": "actual/actual"
      },
      "rounding": {
        "mode": "half_up",
        "digits": 2
      }
    }
  ]
}
