{
  "lexspec": "0.1",
  "id": "thin-coverage",
  "kind": "clause",
  "jurisdiction": ["RU"],
  "corpus": [
    {
      "id": "gk-rf",
      "title": "Гражданский кодекс РФ, извлечение (ст. 506, ст. 309)",
      "revision": "2026-10-01",
      "text": "corpus/gk-rf-2026-10-01.txt",
      "text_sha256": "fc6f39a0237b2cb745506d80466b02c6f317bec8bc21665225074afd5461f36d"
    }
  ],
  "terms": [
    {
      "name": "поставщик",
      "def": "лицо, осуществляющее предпринимательскую деятельность и передающее товары",
      "status": "closed"
    },
    {
      "name": "покупатель",
      "def": "лицо, приобретающее товары для использования в предпринимательской деятельности",
      "status": "closed"
    },
    {
      "name": "товары",
      "def": "производимые или закупаемые поставщиком предметы передачи",
      "status": "closed"
    },
    {
      "name": "надлежащее исполнение",
      "def": "оценочный стандарт исполнения; в v0.1 точнее не определён",
      "status": "open"
    }
  ],
  "atoms": [
    {
      "id": "a1",
      "relation": "duty",
      "bearer": "поставщик",
      "counterparty": "покупатель",
      "action": { "verb": "передать", "object": "товары", "open": false },
      "conditions": ["в обусловленный срок или сроки"],
      "temporal": { "from": "2026-01-01", "until": null },
      "anchor": {
        "corpus": "gk-rf",
        "article": "ст. 506",
        "span": "обязуется передать в обусловленный срок или сроки",
        "note": "закрытый атом"
      }
    },
    {
      "id": "a2",
      "relation": "right",
      "bearer": "покупатель",
      "counterparty": "поставщик",
      "action": { "verb": "передать", "object": "товары", "open": false },
      "conditions": [],
      "temporal": { "from": "2026-01-01", "until": null },
      "anchor": {
        "corpus": "gk-rf",
        "article": "ст. 506",
        "span": "товары покупателю для использования в предпринимательской деятельности",
        "note": "закрытый атом: коррелят a1 с другой стороны"
      }
    },
    {
      "id": "a3",
      "relation": "duty",
      "bearer": "поставщик",
      "counterparty": "покупатель",
      "action": { "verb": "исполнить", "object": "надлежащее исполнение", "open": false },
      "conditions": [],
      "temporal": { "from": "2026-01-01", "until": null },
      "anchor": {
        "corpus": "gk-rf",
        "article": "ст. 309",
        "span": "Обязательства должны исполняться надлежащим образом",
        "note": "открытый атом: 2 из 3 закрыты, покрытие ниже порога 0.8"
      }
    }
  ],
  "conflicts_policy": { "default": "report", "lex_specialis": [] },
  "escapes": [
    {
      "atom": "a3",
      "reason": "OPEN_TERM",
      "detail": "термин «надлежащее исполнение» открыт; покрытие 2/3 объявлено, а не спрятано"
    }
  ]
}
