{
  "lexspec": "0.1",
  "id": "zozpp-26-1-distance-return",
  "kind": "norm",
  "jurisdiction": [
    "RU"
  ],
  "corpus": [
    {
      "id": "zozpp-26-1",
      "title": "Закон РФ «О защите прав потребителей», ст. 26.1 п. 4, извлечение",
      "revision": "2026-10-28",
      "text": "corpus/zozpp-26-1-2026-10-28.txt",
      "text_sha256": "3b4032296aadb37a9cf8f9d174f8cd911d829923533849cdd5d1d7a247e91217"
    }
  ],
  "terms": [
    {
      "name": "потребитель",
      "def": "гражданин, приобретающий товар для личных нужд, не связанных с предпринимательством",
      "status": "closed"
    },
    {
      "name": "продавец",
      "def": "лицо, реализующее товар потребителю дистанционным способом",
      "status": "closed"
    },
    {
      "name": "товар надлежащего качества",
      "def": "товар без недостатков; границы понятия определяются отдельно и здесь не закрыты",
      "status": "open"
    },
    {
      "name": "товар с индивидуально-определёнными свойствами",
      "def": "товар, который может быть использован исключительно приобретающим его потребителем",
      "status": "closed"
    },
    {
      "name": "денежная сумма по договору",
      "def": "уплаченная потребителем цена товара, за вычетом расходов продавца на обратную доставку",
      "status": "closed"
    }
  ],
  "atoms": [
    {
      "id": "a1",
      "relation": "right",
      "bearer": "потребитель",
      "counterparty": "продавец",
      "action": {
        "verb": "отказаться от",
        "object": "товар надлежащего качества",
        "open": false
      },
      "conditions": [
        "в любое время до передачи товара",
        "после передачи — в течение семи дней"
      ],
      "temporal": {
        "from": "1992-02-07",
        "until": null
      },
      "anchor": {
        "corpus": "zozpp-26-1",
        "article": "ст. 26.1 п. 4, абз. 1",
        "span": "Потребитель вправе отказаться от товара в любое время до его передачи, а после передачи товара - в течение семи дней.",
        "note": "срок семь дней остался в conditions как проза: в v0.1 нет ни слоя количеств, ни арифметики дат"
      }
    },
    {
      "id": "a2",
      "relation": "right",
      "bearer": "потребитель",
      "counterparty": "продавец",
      "action": {
        "verb": "отказаться от в течение трёх месяцев",
        "object": "товар надлежащего качества",
        "open": true
      },
      "conditions": [
        "информация о порядке и сроках возврата не предоставлена в письменной форме в момент доставки"
      ],
      "temporal": {
        "from": "1992-02-07",
        "until": null
      },
      "anchor": {
        "corpus": "zozpp-26-1",
        "article": "ст. 26.1 п. 4, абз. 2",
        "span": "потребитель вправе отказаться от товара в течение трех месяцев с момента передачи товара",
        "note": "ветка, которую типовой код возвратов не реализует вовсе; срок — количество"
      }
    },
    {
      "id": "a3",
      "relation": "no-right",
      "bearer": "потребитель",
      "counterparty": "продавец",
      "action": {
        "verb": "отказаться от",
        "object": "товар с индивидуально-определёнными свойствами",
        "open": false
      },
      "conditions": [
        "товар надлежащего качества",
        "может быть использован исключительно приобретающим его потребителем"
      ],
      "temporal": {
        "from": "1992-02-07",
        "until": null
      },
      "anchor": {
        "corpus": "zozpp-26-1",
        "article": "ст. 26.1 п. 4, абз. 4",
        "span": "Потребитель не вправе отказаться от товара надлежащего качества, имеющего индивидуально-определенные свойства",
        "note": "коррелят — привилегия продавца; отрицание права, а не запрет как обязанность"
      }
    },
    {
      "id": "a4",
      "relation": "duty",
      "bearer": "продавец",
      "counterparty": "потребитель",
      "action": {
        "verb": "возвратить в течение десяти дней",
        "object": "денежная сумма по договору",
        "open": true
      },
      "conditions": [
        "за вычетом расходов продавца на доставку от потребителя возвращённого товара"
      ],
      "temporal": {
        "from": "1992-02-07",
        "until": null
      },
      "anchor": {
        "corpus": "zozpp-26-1",
        "article": "ст. 26.1 п. 4, абз. 5",
        "span": "не позднее чем через десять дней со дня предъявления потребителем соответствующего требования",
        "note": "срок возврата денег — количество во времени; типовой код возвратов ставит здесь свои 14 или 30 дней"
      }
    }
  ],
  "conflicts_policy": {
    "default": "report",
    "lex_specialis": []
  },
  "escapes": [
    {
      "atom": "a1",
      "reason": "OPEN_TERM",
      "detail": "«товар надлежащего качества» — открытый термин: что считать надлежащим качеством, решается отдельно и часто спором, поэтому центральное право покупателя не закрывается. Это находка о норме, а не дефект кодировки"
    },
    {
      "atom": "a2",
      "reason": "OPEN_TERM",
      "detail": "трёхмесячный срок — количество во времени: без слоя количеств и арифметики дат атом не закрывается"
    },
    {
      "atom": "a4",
      "reason": "OPEN_TERM",
      "detail": "десятидневный срок возврата денег — количество во времени; без L5 граница невыразима"
    }
  ]
}
