{
  "lexspec": "0.1",
  "id": "delivery-ok",
  "kind": "clause",
  "jurisdiction": [
    "RU"
  ],
  "corpus": [
    {
      "id": "gk-rf",
      "title": "Гражданский кодекс РФ, извлечение (ст. 506, ст. 309)",
      "revision": "2026-10-01",
      "text": "corpus/gk-rf-2026-10-01.txt",
      "text_sha256": "5fee7dadad023cceb9f94247f76a42931dedf95c3977f04654ab758d47612cb0"
    }
  ],
  "terms": [
    {
      "name": "поставщик",
      "def": "лицо, осуществляющее предпринимательскую деятельность и передающее товары",
      "status": "closed"
    },
    {
      "name": "покупатель",
      "def": "лицо, приобретающее товары для использования в предпринимательской деятельности",
      "status": "closed"
    },
    {
      "name": "товары",
      "def": "производимые или закупаемые поставщиком предметы передачи",
      "status": "closed"
    },
    {
      "name": "обязательство",
      "def": "отношение, в силу которого должник обязан совершить определённое действие",
      "status": "closed"
    }
  ],
  "atoms": [
    {
      "id": "a1",
      "relation": "duty",
      "bearer": "поставщик",
      "counterparty": "покупатель",
      "action": {
        "verb": "передать",
        "object": "товары",
        "open": false
      },
      "conditions": [
        "в обусловленный срок или сроки"
      ],
      "temporal": {
        "from": "2026-01-01",
        "until": null
      },
      "anchor": {
        "corpus": "gk-rf",
        "article": "ст. 506",
        "span": "обязуется передать в обусловленный срок или сроки",
        "note": "ядро обязанности поставщика"
      }
    },
    {
      "id": "a2",
      "relation": "right",
      "bearer": "покупатель",
      "counterparty": "поставщик",
      "action": {
        "verb": "передать",
        "object": "товары",
        "open": false
      },
      "conditions": [],
      "temporal": {
        "from": "2026-01-01",
        "until": null
      },
      "anchor": {
        "corpus": "gk-rf",
        "article": "ст. 506",
        "span": "товары покупателю для использования в предпринимательской деятельности",
        "note": "коррелят a1 с другой стороны отношения"
      }
    },
    {
      "id": "a3",
      "relation": "duty",
      "bearer": "поставщик",
      "counterparty": "покупатель",
      "action": {
        "verb": "исполнить",
        "object": "обязательство",
        "open": false
      },
      "conditions": [
        "надлежащим образом",
        "в соответствии с условиями обязательства"
      ],
      "temporal": {
        "from": "2026-01-01",
        "until": null
      },
      "anchor": {
        "corpus": "gk-rf",
        "article": "ст. 309",
        "span": "Обязательства должны исполняться надлежащим образом",
        "note": "общий стандарт исполнения"
      }
    }
  ],
  "conflicts_policy": {
    "default": "report",
    "lex_specialis": []
  },
  "escapes": []
}
