{
  "lexspec": "0.1",
  "id": "unresolved-conflict",
  "kind": "scenario",
  "jurisdiction": [
    "RU"
  ],
  "corpus": [
    {
      "id": "gk-rf",
      "title": "Гражданский кодекс РФ, извлечение (ст. 506, ст. 309)",
      "revision": "2026-10-01",
      "text": "corpus/gk-rf-2026-10-01.txt",
      "text_sha256": "5fee7dadad023cceb9f94247f76a42931dedf95c3977f04654ab758d47612cb0"
    }
  ],
  "terms": [
    {
      "name": "поставщик",
      "def": "лицо, осуществляющее предпринимательскую деятельность и передающее товары",
      "status": "closed"
    },
    {
      "name": "покупатель",
      "def": "лицо, приобретающее товары для использования в предпринимательской деятельности",
      "status": "closed"
    },
    {
      "name": "товары",
      "def": "производимые или закупаемые поставщиком предметы передачи",
      "status": "closed"
    }
  ],
  "atoms": [
    {
      "id": "a1",
      "relation": "right",
      "bearer": "покупатель",
      "counterparty": "поставщик",
      "action": {
        "verb": "передать",
        "object": "товары",
        "open": false
      },
      "conditions": [],
      "temporal": {
        "from": "2026-01-01",
        "until": null
      },
      "anchor": {
        "corpus": "gk-rf",
        "article": "ст. 506",
        "span": "товары покупателю для использования в предпринимательской деятельности",
        "note": "притязание покупателя на передачу товаров"
      }
    },
    {
      "id": "a2",
      "relation": "duty",
      "bearer": "покупатель",
      "counterparty": "поставщик",
      "action": {
        "verb": "передать",
        "object": "товары",
        "open": false
      },
      "conditions": [],
      "temporal": {
        "from": "2026-01-01",
        "until": null
      },
      "anchor": {
        "corpus": "gk-rf",
        "article": "ст. 506",
        "span": "обязуется передать в обусловленный срок или сроки",
        "note": "коррелят притязания a1 написан на той же стороне пары — это и есть рассогласование; спека §7 отмечает, что случай двух настоящих взаимных обязанностей об одном действии тоже попадёт сюда (известное ложноположительное срабатывание)"
      }
    }
  ],
  "conflicts_policy": {
    "default": "lex_specialis",
    "lex_specialis": []
  },
  "escapes": []
}
