{
  "lexspec": "0.1",
  "id": "open-term",
  "kind": "clause",
  "jurisdiction": ["RU"],
  "corpus": [
    {
      "id": "gk-rf",
      "title": "Гражданский кодекс РФ, извлечение (ст. 506, ст. 309)",
      "revision": "2026-10-01",
      "text": "corpus/gk-rf-2026-10-01.txt",
      "text_sha256": "fc6f39a0237b2cb745506d80466b02c6f317bec8bc21665225074afd5461f36d"
    }
  ],
  "terms": [
    {
      "name": "поставщик",
      "def": "лицо, осуществляющее предпринимательскую деятельность и передающее товары",
      "status": "closed"
    },
    {
      "name": "покупатель",
      "def": "лицо, приобретающее товары для использования в предпринимательской деятельности",
      "status": "closed"
    },
    {
      "name": "товары",
      "def": "производимые или закупаемые поставщиком предметы передачи",
      "status": "closed"
    },
    {
      "name": "обязательство",
      "def": "отношение, в силу которого должник обязан совершить определённое действие",
      "status": "closed"
    },
    {
      "name": "обычаи",
      "def": "обычаи или иные обычно предъявляемые требования, применимые при отсутствии условий",
      "status": "closed"
    },
    {
      "name": "надлежащее исполнение",
      "def": "оценочный стандарт исполнения; в v0.1 точнее не определён",
      "status": "open"
    }
  ],
  "atoms": [
    {
      "id": "a1",
      "relation": "duty",
      "bearer": "поставщик",
      "counterparty": "покупатель",
      "action": { "verb": "передать", "object": "товары", "open": false },
      "conditions": ["в обусловленный срок или сроки"],
      "temporal": { "from": "2026-01-01", "until": null },
      "anchor": {
        "corpus": "gk-rf",
        "article": "ст. 506",
        "span": "обязуется передать в обусловленный срок или сроки",
        "note": "закрытая часть: обязанность передать товары"
      }
    },
    {
      "id": "a2",
      "relation": "right",
      "bearer": "покупатель",
      "counterparty": "поставщик",
      "action": { "verb": "передать", "object": "товары", "open": false },
      "conditions": [],
      "temporal": { "from": "2026-01-01", "until": null },
      "anchor": {
        "corpus": "gk-rf",
        "article": "ст. 506",
        "span": "товары покупателю для использования в предпринимательской деятельности",
        "note": "коррелят a1 с другой стороны отношения: пары сторон разные, рассогласования нет"
      }
    },
    {
      "id": "a3",
      "relation": "duty",
      "bearer": "поставщик",
      "counterparty": "покупатель",
      "action": { "verb": "исполнить", "object": "обязательство", "open": false },
      "conditions": ["в соответствии с условиями обязательства"],
      "temporal": { "from": "2026-01-01", "until": null },
      "anchor": {
        "corpus": "gk-rf",
        "article": "ст. 309",
        "span": "Обязательства должны исполняться надлежащим образом",
        "note": "закрытая часть: общий стандарт исполнения"
      }
    },
    {
      "id": "a4",
      "relation": "duty",
      "bearer": "поставщик",
      "counterparty": "покупатель",
      "action": { "verb": "соблюдать", "object": "обычаи", "open": false },
      "conditions": ["при отсутствии условий обязательства и требований закона"],
      "temporal": { "from": "2026-01-01", "until": null },
      "anchor": {
        "corpus": "gk-rf",
        "article": "ст. 309",
        "span": "в соответствии с обычаями или иными обычно предъявляемыми требованиями",
        "note": "закрытая часть: субсидиарный источник требований"
      }
    },
    {
      "id": "a5",
      "relation": "duty",
      "bearer": "поставщик",
      "counterparty": "покупатель",
      "action": { "verb": "исполнить", "object": "надлежащее исполнение", "open": false },
      "conditions": [],
      "temporal": { "from": "2026-01-01", "until": null },
      "anchor": {
        "corpus": "gk-rf",
        "article": "ст. 309",
        "span": "в соответствии с условиями обязательства и требованиями закона",
        "note": "открытая часть: термин не определён достаточно точно, атом остаётся открытым и объявлен в escapes[]"
      }
    }
  ],
  "conflicts_policy": { "default": "report", "lex_specialis": [] },
  "escapes": [
    {
      "atom": "a5",
      "reason": "OPEN_TERM",
      "detail": "термин «надлежащее исполнение» объявлен открытым: стандарт не формализован, покрытие снижено осознанно"
    }
  ]
}
